{
  "session_key_hash": "a591b6e7f2d8c7e9f0a1b2c3d4e5f6a7b8c9d0e1f2a3b4c5d6e7f8a9b0c1d2e3",
  "hash_algorithm": "sha256",
  "subject_id": "subject_001",
  "created_at": "2026-05-08T12:00:00+00:00",
  "last_rotated_at": "2026-05-08T12:00:00+00:00",
  "rotation_count": 0,
  "key_scope_resolvable": false,
  "audit_event_on_rotation": true
}
